Base Query,Rewritten 1,Rewritten 2,Rewritten 3,Điều,Chương,Trả lời
"Khi đến đường giao nhau có hoặc không có vòng xuyến, quy tắc nhường đường ra sao?",Làm thế nào để nhường đường đúng quy định khi gặp đường giao nhau với vòng xuyến?,"Tại giao lộ không có vòng xuyến, người lái xe cần tuân thủ nguyên tắc nhường đường nào?",Quy tắc nhường đường khi gặp đường giao nhau có và không có vòng xuyến khác nhau ra sao?,22,2,"Nếu đường giao nhau không có vòng xuyến, người điều khiển phương tiện phải nhường đường cho xe đi từ bên phải.
Nếu đường giao nhau có vòng xuyến, người lái xe phải nhường đường cho xe đi từ bên trái."
"Khi đến bến phà hoặc cầu phao, người điều khiển phương tiện cần tuân thủ quy định nào để đảm bảo an toàn và trật tự?",Làm thế nào để các phương tiện giữ trật tự khi chờ qua phà hoặc cầu phao?,Người lái xe cần làm gì khi đến bến phà hoặc cầu phao để không gây cản trở giao thông?,Có quy định gì về việc xếp hàng cho xe khi đến phà hoặc cầu phao?,23,2,"Khi đến bến phà hoặc cầu phao, các xe phải xếp hàng đúng quy định và không được gây cản trở giao thông."
"Thứ tự ưu tiên cho các phương tiện khi qua phà, cầu phao được quy định như thế nào?",Xe nào được phép qua phà hoặc cầu phao trước?,"Khi có nhiều phương tiện đến cùng lúc, thứ tự ưu tiên qua phà là gì?",Những loại xe nào được ưu tiên qua phà trước các xe khác?,23,2,"Thứ tự ưu tiên là:
- Xe ưu tiên
- Xe chở thư báo
- Xe chở thực phẩm tươi sống
- Xe chở khách công cộng
- Nếu xe cùng thứ tự ưu tiên đến cùng lúc, xe nào đến trước được qua trước."
"Khi xuống phà, người và phương tiện cần tuân thủ quy định nào để đảm bảo an toàn?",Người đi bộ và xe cộ phải làm gì khi xuống phà?,Có những quy tắc nào dành cho hành khách và phương tiện khi lên xuống phà?,Làm thế nào để đảm bảo an toàn cho người và phương tiện khi rời phà?,23,2,"Khi xe xuống phà, người không được ở trên xe trừ người lái, trẻ em, phụ nữ mang thai, người già, người khuyết tật và người bệnh. Xe cơ giới xuống trước, người đi bộ xuống sau. Khi lên bến, người đi bộ lên trước, phương tiện lên sau theo hướng dẫn."
"Khi qua cầu phao, người điều khiển phương tiện phải tuân thủ quy định gì?",Các phương tiện cần lưu ý điều gì khi di chuyển qua cầu phao?,Làm sao để đảm bảo an toàn khi xe và người đi bộ qua cầu phao?,Có những yêu cầu nào đối với xe cơ giới và người đi bộ khi đi qua cầu phao?,23,2,"Xe cơ giới phải đi theo hàng, không cản trở xe đi ngược chiều. Người đi bộ và xe thô sơ phải đi sát bên phải theo chiều đi, không cản trở các phương tiện khác. Mọi người phải tuân theo hướng dẫn của người điều khiển giao thông."
"Khi gặp đèn đỏ nhấp nháy, chuông kêu hoặc chắn đường bộ đang đóng gần đường sắt, người tham gia giao thông cần làm gì?",Người lái xe phải làm gì khi thấy chắn tàu đang đóng hoặc đèn tín hiệu gần đường sắt bật sáng?,Bạn nên xử lý thế nào khi gặp tín hiệu báo tàu sắp đến?,Có quy tắc nào khi đến gần đường sắt mà đèn đỏ và chuông kêu?,24,2,"Người tham gia giao thông phải dừng lại bên phải đường của mình, trước vạch dừng xe khi thấy nhân viên gác chắn ra hiệu, đèn đỏ nhấp nháy, chuông kêu hoặc chắn đường đang đóng."
"Khi đến đường ngang không có người gác hay tín hiệu cảnh báo, người tham gia giao thông phải làm gì để đảm bảo an toàn?","Nếu đường sắt không có chắn hay đèn cảnh báo, người lái xe cần làm gì?",Bạn sẽ xử lý thế nào khi tới đường ngang không có tín hiệu báo tàu?,Có quy định gì khi băng qua đường sắt mà không thấy nhân viên gác chắn?,24,2,"Người tham gia giao thông phải dừng lại bên phải đường của mình, trước vạch dừng xe, quan sát kỹ hai phía và chỉ đi qua khi không có tàu sắp đến."
"Nếu phương tiện bị hỏng hoặc xảy ra sự cố trên đường ngang, người điều khiển phương tiện cần làm gì?",Người lái xe nên làm gì khi xe gặp sự cố trên đường ray?,"Nếu có tai nạn hoặc hàng hóa rơi trên đường sắt, bạn phải xử lý ra sao?",Có quy định nào khi phương tiện không thể di chuyển khỏi đường ngang an toàn?,24,2,"Người điều khiển phương tiện và những người có mặt phải ngay lập tức báo hiệu để dừng tàu và thực hiện các biện pháp bảo đảm an toàn khi xe bị hỏng, gặp tai nạn hoặc có vật cản trên đường sắt."
"Khi nhập vào làn đường trên đường cao tốc, người lái xe cần tuân thủ những quy tắc nào?",Người lái xe phải làm gì trước khi nhập làn trên đường cao tốc?,"Khi muốn tham gia vào đường cao tốc, bạn nên chú ý điều gì để đảm bảo an toàn?",Có quy định nào về cách nhập làn khi di chuyển vào đường cao tốc không?,25,2,"Trước khi nhập làn, người lái xe phải bật tín hiệu xin vào, nhường đường cho xe đang chạy trên đường cao tốc, quan sát phía sau để bảo đảm khoảng cách an toàn. Nếu có làn đường tăng tốc, xe phải chạy trên làn đó trước khi nhập làn."
"Nếu xe gặp sự cố trên đường cao tốc, người điều khiển phương tiện phải xử lý ra sao?",Bạn nên làm gì khi xe hỏng bất ngờ trên đường cao tốc?,Có quy định gì về việc dừng xe khẩn cấp trên đường cao tốc?,"Khi không thể di chuyển xe vào làn dừng khẩn cấp trên cao tốc, người lái cần làm gì?",25,2,"Nếu gặp sự cố, người lái xe phải dừng xe ở làn dừng khẩn cấp, bật đèn cảnh báo nguy hiểm. Nếu xe không thể di chuyển, phải đặt biển hoặc đèn cảnh báo phía sau cách tối thiểu 150 mét và báo cho Cảnh sát giao thông hoặc cơ quan quản lý đường cao tốc."
Những loại phương tiện nào không được phép di chuyển trên đường cao tốc?,Xe máy và xe thô sơ có được đi trên đường cao tốc không?,Ai không được phép tham gia giao thông trên đường cao tốc?,Có giới hạn nào về phương tiện khi đi trên cao tốc?,25,2,"Xe máy, xe gắn máy, xe thô sơ, xe mô tô có tốc độ thiết kế dưới mức tối thiểu quy định, xe chở người bốn bánh gắn động cơ, người đi bộ và các loại xe tương tự không được phép đi trên đường cao tốc, trừ phương tiện phục vụ quản lý và bảo trì."
"Khi lái xe trong hầm đường bộ, người điều khiển phương tiện cần tuân thủ quy định gì về đèn chiếu sáng?",Xe tham gia giao thông trong hầm đường bộ phải bật loại đèn nào?,Người lái xe cần lưu ý điều gì về hệ thống chiếu sáng khi đi qua hầm đường bộ?,Có quy định gì về việc sử dụng đèn khi điều khiển phương tiện trong hầm đường bộ?,26,2,"Khi di chuyển trong hầm đường bộ, xe cơ giới và xe máy chuyên dùng phải bật đèn chiếu gần; xe thô sơ phải bật đèn hoặc có vật phát sáng để báo hiệu."
"Trong trường hợp xe gặp sự cố trong hầm đường bộ, người lái xe cần làm gì để đảm bảo an toàn?",Người lái xe phải xử lý ra sao khi xe hỏng trong hầm đường bộ?,"Nếu không thể di chuyển xe trong hầm, người điều khiển phương tiện nên làm gì?",Có quy định nào về việc dừng xe trong hầm đường bộ khi gặp sự cố không?,26,2,"Khi gặp sự cố, người lái xe phải đưa xe vào vị trí dừng khẩn cấp. Nếu không di chuyển được, cần bật đèn khẩn cấp, đặt biển hoặc đèn cảnh báo phía sau xe với khoảng cách an toàn và nhanh chóng báo cho Cảnh sát giao thông hoặc cơ quan quản lý hầm."
"Ngoài quy định về đèn và dừng xe, người điều khiển phương tiện trong hầm đường bộ cần chú ý gì khác?",Có những quy tắc nào khác mà người lái xe phải tuân thủ khi đi trong hầm?,"Khi lái xe trong hầm đường bộ, ngoài việc bật đèn, người lái cần lưu ý thêm điều gì?",Những quy định nào trong giao thông đường bộ cũng áp dụng khi di chuyển trong hầm?,26,2,"Ngoài việc bật đèn chiếu sáng và không dừng xe khi không cần thiết, người điều khiển phương tiện phải tuân thủ các quy tắc giao thông đường bộ khác được quy định trong Chương này, bao gồm giữ khoảng cách an toàn và tuân theo biển báo hiệu."
Xe ưu tiên gồm những loại xe nào?,Những phương tiện nào được xếp vào danh sách xe ưu tiên?,Loại xe nào được quyền ưu tiên khi tham gia giao thông?,Xe ưu tiên bao gồm các phương tiện nào trong giao thông?,27,2,"Xe ưu tiên gồm xe chữa cháy, xe quân sự, xe công an, xe kiểm sát đi làm nhiệm vụ khẩn cấp, xe cứu thương, xe hộ đê, xe cứu nạn cứu hộ, đoàn xe có xe cảnh sát dẫn đường và đoàn xe tang."
Thứ tự ưu tiên khi các xe ưu tiên qua đường giao nhau được sắp xếp như thế nào?,Xe ưu tiên được quyền đi trước theo thứ tự nào khi đến đường giao nhau?,"Khi qua ngã tư, thứ tự ưu tiên của các xe ưu tiên là gì?",Các loại xe ưu tiên được sắp xếp quyền ưu tiên ra sao khi cùng đến giao lộ?,27,2,"Thứ tự ưu tiên từ cao xuống thấp là: xe chữa cháy, xe quân sự, công an, kiểm sát đi làm nhiệm vụ khẩn cấp, xe cứu thương, xe hộ đê, xe cứu nạn cứu hộ, đoàn xe tang."
Xe ưu tiên cần có tín hiệu gì khi tham gia giao thông?,Các xe ưu tiên phải sử dụng loại tín hiệu nào để được ưu tiên khi lưu thông?,Xe ưu tiên khi làm nhiệm vụ cần bật tín hiệu gì?,Tín hiệu ưu tiên của các loại xe ưu tiên được quy định ra sao?,27,2,"Xe ưu tiên phải bật đèn nhấp nháy theo quy định: xe chữa cháy, xe quân sự, xe cứu thương dùng đèn đỏ; xe công an, kiểm sát và xe cảnh sát dẫn đường dùng đèn đỏ và xanh; xe cứu hộ, cứu nạn và xe hộ đê dùng đèn xanh."
Xe ưu tiên có được vượt đèn đỏ và đi ngược chiều không?,Xe ưu tiên được phép đi thế nào khi gặp đèn tín hiệu giao thông?,"Khi làm nhiệm vụ, xe ưu tiên có được đi ngược chiều và bỏ qua tín hiệu đèn không?",Xe ưu tiên có bị giới hạn tốc độ hoặc bị cấm đi ngược chiều không?,27,2,"Xe ưu tiên được phép vượt đèn đỏ, không bị giới hạn tốc độ, đi ngược chiều (trừ đường cao tốc chỉ được đi trên làn dừng khẩn cấp) nhưng phải tuân theo hiệu lệnh người điều khiển giao thông và biển báo tạm thời."
"Khi có tín hiệu của xe ưu tiên, người tham gia giao thông phải làm gì?",Người điều khiển phương tiện cần làm gì khi gặp xe ưu tiên?,Xe khác phải xử lý thế nào khi nghe thấy tín hiệu của xe ưu tiên?,"Khi xe ưu tiên đến gần, các phương tiện và người đi bộ nên làm gì?",27,2,"Người và phương tiện phải giảm tốc độ, đi sát lề phải hoặc dừng lại nhường đường; trạm thu phí phải ưu tiên cho xe ưu tiên qua mà không gây cản trở."
Màu sắc đèn tín hiệu ưu tiên của các loại xe ưu tiên khác nhau ra sao?,Các loại xe ưu tiên sử dụng màu đèn tín hiệu gì khi làm nhiệm vụ?,Đèn tín hiệu ưu tiên của xe cứu thương và xe công an có gì khác nhau?,Tín hiệu màu sắc trên xe ưu tiên được quy định như thế nào?,27,2,"Xe chữa cháy, xe quân sự, xe cứu thương dùng đèn đỏ; xe công an, kiểm sát, cảnh sát dẫn đường dùng đèn đỏ và xanh; xe cứu nạn, cứu hộ và xe hộ đê dùng đèn xanh."
Đoàn xe tang có được xem là xe ưu tiên không?,Xe tang có nằm trong danh sách xe ưu tiên khi tham gia giao thông không?,Đoàn xe tang có được quyền ưu tiên trên đường không?,Trong trường hợp nào đoàn xe tang được ưu tiên khi đi trên đường?,27,2,Đoàn xe tang được xem là xe ưu tiên nhưng có thứ tự ưu tiên thấp nhất trong các loại xe ưu tiên.
Xe ưu tiên có được quyền đi vào làn dừng khẩn cấp trên đường cao tốc không?,Xe ưu tiên khi cần đi ngược chiều trên cao tốc phải tuân thủ quy định gì?,Có trường hợp nào xe ưu tiên được phép đi vào làn dừng khẩn cấp không?,Xe ưu tiên đi trên đường cao tốc có bị hạn chế làn đường không?,27,2,Xe ưu tiên được phép đi ngược chiều trên đường cao tốc nhưng chỉ được đi trên làn dừng khẩn cấp.
Chính phủ quy định ra sao về việc lắp đặt và sử dụng thiết bị phát tín hiệu của xe ưu tiên?,Ai có thẩm quyền cấp phép sử dụng thiết bị phát tín hiệu xe ưu tiên?,Việc quản lý thiết bị phát tín hiệu xe ưu tiên được quy định như thế nào?,Có quy trình nào cho việc cấp mới hoặc thu hồi thiết bị tín hiệu xe ưu tiên không?,27,2,"Chính phủ quy định chi tiết về quản lý, lắp đặt, sử dụng và trình tự cấp mới, cấp lại, thu hồi giấy phép thiết bị phát tín hiệu của xe ưu tiên."
Xe ưu tiên khi làm nhiệm vụ có được miễn phí qua trạm thu phí không?,Trạm thu phí phải xử lý thế nào khi xe ưu tiên tới?,Xe ưu tiên có phải dừng lại trả phí khi qua trạm thu phí không?,Có quy định gì về việc ưu tiên xe ưu tiên qua trạm thu phí?,27,2,Xe ưu tiên phải được ưu tiên qua trạm thu phí trong mọi tình huống mà không bị cản trở.
Trong những trường hợp nào xe ô tô chở hàng được phép chở người?,Khi nào xe tải được chở người trên thùng xe?,Xe ô tô chở hàng được phép chở người trong những tình huống nào?,Xe chở hàng có thể chở người khi nào mà không vi phạm quy định?,28,2,"Xe ô tô chở hàng được phép chở người khi: chở người làm nhiệm vụ cứu nạn, cứu hộ, phòng chống thiên tai, dịch bệnh, cấp cứu người bị nạn; chở lực lượng vũ trang đi làm nhiệm vụ khẩn cấp; chở người học lái, sát hạch lái, công nhân bảo dưỡng đường; chở người diễu hành khi được phép."
Xe ô tô chở hàng phải tuân thủ quy định gì khi chở người trong các trường hợp được phép?,"Khi chở người, xe chở hàng cần đảm bảo yêu cầu gì?",Xe tải khi chở người hợp pháp phải chú ý điều gì để đảm bảo an toàn?,Có quy định gì về an toàn khi xe chở hàng được phép chở người?,28,2,Xe ô tô chở hàng phải đảm bảo an toàn khi tham gia giao thông trong các trường hợp được phép chở người.
Xe ô tô được phép kéo theo xe khác trong những trường hợp nào?,Khi nào xe ô tô có thể kéo theo một xe khác?,Xe ô tô được kéo xe khác trong tình huống nào?,Xe nào được phép kéo theo xe khác và trong trường hợp gì?,29,2,"Xe ô tô chỉ được kéo theo một xe ô tô hoặc xe máy chuyên dùng khác khi xe đó không tự chạy được, trừ trường hợp đặc biệt theo quy định, và phải tuân thủ các yêu cầu an toàn."
"Khi kéo xe, xe kéo và xe được kéo phải đáp ứng những điều kiện gì?",Xe kéo và xe được kéo cần đảm bảo yêu cầu gì để an toàn?,Có những quy định nào khi một xe ô tô kéo xe khác?,"Khi kéo xe, điều kiện an toàn cho xe kéo và xe được kéo là gì?",29,2,"Xe được kéo phải có người điều khiển, hệ thống lái còn hiệu lực, nối chắc chắn; nếu hệ thống hãm không còn hiệu lực, phải nối bằng thanh nối cứng. Cả xe kéo và xe được kéo phải có biển báo hiệu và đèn cảnh báo nhấp nháy màu vàng."
Những quy định nào liên quan đến việc chở người khi xe đang kéo xe khác?,Xe đang kéo xe khác có được chở người không?,Có được phép chở người trên xe được kéo không?,Người điều khiển xe kéo xe khác phải tuân thủ điều gì về chở người?,29,2,"Không được chở người trên xe được kéo, trừ người điều khiển xe đó. Xe kéo rơ moóc hoặc xe đầu kéo kéo sơ mi rơ moóc không được kéo thêm rơ moóc hay xe khác."
Người đi bộ cần tuân thủ những quy định nào khi tham gia giao thông?,Người đi bộ phải làm gì để đảm bảo an toàn khi tham gia giao thông?,Những quy định dành cho người đi bộ khi tham gia giao thông là gì?,Người đi bộ cần chú ý điều gì khi di chuyển trên đường?,30,2,"Người đi bộ phải đi trên vỉa hè, lề đường hoặc đường dành riêng cho người đi bộ. Khi qua đường, họ phải sử dụng đèn tín hiệu, vạch kẻ đường, cầu vượt hoặc hầm đi bộ, và tuân thủ tín hiệu chỉ dẫn. Nếu không có các thiết bị này, người đi bộ phải quan sát kỹ, chỉ qua khi an toàn và ra hiệu bằng tay."
Trẻ em dưới 07 tuổi cần tuân thủ quy định gì khi qua đường?,"Khi đi qua đường, trẻ em dưới 07 tuổi cần được hỗ trợ như thế nào?",Có yêu cầu gì dành cho trẻ em dưới 07 tuổi khi tham gia giao thông?,Trẻ em dưới 07 tuổi có được tự ý qua đường không?,30,2,Trẻ em dưới 07 tuổi khi đi qua đường phải có người lớn dẫn dắt để đảm bảo an toàn.
Người khuyết tật và người khiếm thị được hỗ trợ như thế nào khi tham gia giao thông?,Có quy định gì dành cho người khuyết tật khi tham gia giao thông đường bộ?,Người khiếm thị phải tuân thủ điều gì khi di chuyển trên đường?,Người khuyết tật và người khiếm thị cần lưu ý gì khi đi bộ?,30,2,"Người khuyết tật sử dụng xe lăn phải đi trên vỉa hè, lề đường hoặc nơi có vạch kẻ đường. Người khiếm thị cần có người dẫn dắt hoặc công cụ báo hiệu để người khác nhận biết và hỗ trợ."
"Mọi người cần làm gì khi gặp phụ nữ mang thai, người già yếu hoặc người mất năng lực hành vi dân sự qua đường?","Mọi người cần làm gì khi gặp phụ nữ mang thai, người già yếu hoặc người mất năng lực hành vi dân sự qua đường?","Khi thấy phụ nữ mang thai hoặc người già đang qua đường, chúng ta nên làm gì?",Có quy định gì về việc giúp đỡ người gặp khó khăn khi qua đường?,30,2,"Mọi người có trách nhiệm giúp đỡ trẻ em dưới 07 tuổi, phụ nữ mang thai, người già yếu, người khuyết tật và người mất năng lực hành vi dân sự khi họ qua đường để đảm bảo an toàn cho họ."
"Người điều khiển xe đạp, xe đạp máy được chở tối đa bao nhiêu người?","Người đi xe đạp, xe đạp máy có thể chở được bao nhiêu người?","Có quy định gì về số người được chở trên xe đạp, xe đạp máy?","Xe đạp, xe đạp máy được phép chở tối đa mấy người khi tham gia giao thông?",31,2,"Người điều khiển xe đạp, xe đạp máy chỉ được chở một người, trừ trường hợp chở thêm một trẻ em dưới 07 tuổi thì được chở tối đa hai người."
Người điều khiển và người được chở trên xe đạp máy phải tuân thủ quy định gì về an toàn?,"Khi đi xe đạp máy, người lái xe và người ngồi sau cần lưu ý điều gì?",Có yêu cầu gì về an toàn cho người đi xe đạp máy và người được chở?,Người lái và người ngồi trên xe đạp máy phải tuân thủ những quy tắc nào?,31,2,Người điều khiển và người được chở trên xe đạp máy phải đội mũ bảo hiểm đúng quy chuẩn kỹ thuật quốc gia và cài quai đúng quy cách.
Khi nào người điều khiển xe thô sơ phải sử dụng đèn hoặc báo hiệu?,Người đi xe thô sơ cần dùng đèn trong thời gian nào?,Khi nào xe thô sơ phải có báo hiệu phía trước và phía sau?,Có quy định gì về việc sử dụng đèn cho xe thô sơ khi tham gia giao thông?,31,2,Người điều khiển xe thô sơ phải sử dụng đèn hoặc có báo hiệu phía trước và phía sau xe khi tham gia giao thông từ 18 giờ ngày hôm trước đến 06 giờ ngày hôm sau.
Hàng hóa xếp trên xe thô sơ cần tuân thủ những quy định gì?,Có giới hạn gì về kích thước hàng hóa khi chở bằng xe thô sơ?,Hàng hóa được phép xếp như thế nào trên xe thô sơ để đảm bảo an toàn?,Người chở hàng trên xe thô sơ cần chú ý điều gì để không vi phạm?,31,2,"Hàng hóa xếp trên xe thô sơ phải đảm bảo an toàn, không cản trở giao thông hay che khuất tầm nhìn. Hàng không được vượt quá 1/3 chiều dài thân xe, 01 mét phía trước và sau xe, và không vượt quá 0,4 mét mỗi bên bánh xe."
Người điều khiển xe thô sơ cần tuân thủ những quy tắc gì khi di chuyển trên đường?,Có yêu cầu gì về việc đi xe thô sơ trên đường?,Người đi xe thô sơ phải làm gì để đảm bảo an toàn khi tham gia giao thông?,Xe thô sơ nên di chuyển như thế nào trên đường để không vi phạm?,31,2,"Người điều khiển xe thô sơ phải đi hàng một, đúng phần đường quy định dành cho xe thô sơ, và khi đi ban đêm phải có đèn hoặc báo hiệu."
"Người điều khiển, dẫn dắt vật nuôi khi đi trên đường bộ phải tuân thủ quy định gì?","Khi dắt vật nuôi trên đường, người điều khiển cần chú ý điều gì?",Có quy định gì khi dẫn dắt vật nuôi tham gia giao thông đường bộ?,Người dắt vật nuôi đi trên đường cần tuân thủ những nguyên tắc nào?,32,2,"Người điều khiển, dẫn dắt vật nuôi phải cho vật nuôi đi sát mép đường bên phải, quan sát kỹ trước khi cho vật nuôi qua đường và không được gây cản trở cho người và phương tiện tham gia giao thông khác."
Vật nuôi có được đi vào làn đường dành cho xe cơ giới không?,Có được phép dắt vật nuôi vào làn đường xe cơ giới không?,"Người dắt vật nuôi có thể đi vào làn đường dành cho xe máy, ô tô không?",Làn đường xe cơ giới có cho phép dẫn vật nuôi đi vào không?,32,2,"Không được điều khiển, dẫn dắt vật nuôi hoặc điều khiển xe vật nuôi kéo đi vào làn đường dành cho xe cơ giới."
Có được thả vật nuôi tự do trên đường bộ không?,Người tham gia giao thông có được thả vật nuôi trên đường không?,Thả vật nuôi đi lại tự do trên đường có vi phạm không?,Có quy định gì về việc thả vật nuôi khi tham gia giao thông đường bộ?,32,2,Không được thả vật nuôi trên đường bộ.
"Người lái xe mô tô hai bánh, xe gắn máy được chở tối đa bao nhiêu người?",Xe máy hai bánh được phép chở tối đa bao nhiêu người?,Khi nào người lái xe máy được chở hai người?,Có trường hợp nào được phép chở hai người trên xe mô tô hai bánh không?,33,2,"Người lái xe mô tô hai bánh, xe gắn máy chỉ được chở một người, trừ các trường hợp: chở người bệnh đi cấp cứu, áp giải người vi phạm pháp luật, chở trẻ em dưới 12 tuổi, hoặc chở người già yếu, người khuyết tật."
